,Unnamed: 0,date,elite,num_friends,num_photos,num_reviews,rating,restaurantId,review_id,review_text,useful,username
177,177,8/24/2015,0,74,3,17,2.0,customer_0,VWZOe-9KQGtBtj2kPbS3og,"My boyfriend and I went on Sunday night to the new location uptown. It was pretty crowed but we managed to get seated quickly near the back kitchen area next to the bar. We saw our waiter 2 times that night. First time when he took our order, second time to take our check and apologize to us about how terrible the service was. I have to say the food was excellent but it took an incredibly long time for us to get our food, drinks and even when we tried to order dessert it took so long that we had to again wave down someone to cancel the dessert order because we had to get going. As all of this was going on I could see our waiter behind the bar/ in the kitchen talking and laughing with his staff, obviously too busy to help us with anything so the busy bartender and hostess kept coming over to get our drinks, desert and give us the check at the end of the meal. The entire time we felt like we were pulling teeth trying to get anyone's attention all the while, watching our waiter in the kitchen/ bar talking and doing nothing. It was busy that night but there's no excuse for that. The food was incredible so that would be the only thing that would bring me back. Maybe next time they will be better staffed.",0,Dina D.
178,178,8/23/2015,0,5,0,16,2.0,customer_0,9OEXXZ6Y5KWuIdPju6Bqsg,The food is nothing to brag about. Gets 2 stars because the waiter was really pleasant. Wouldn't go back & wouldn't recommend it to my friends and family.,0,Stephanie S.
179,179,8/21/2015,0,125,1,124,2.0,customer_0,dWoWWMWUicw39I4O4kcO6Q,"I had high hopes for the new location of La Isla. I'm sad to say the service at the bar was atrocious; first no flatware, then no glasses for sangria, then forgot a dish and a drink. Combined with the general chaos behind the bar and it made quite an unpleasant experience. Too bad too because the food itself was pretty good.",0,Zach Y.
180,180,8/21/2015,0,0,0,11,5.0,customer_0,Hsr5hQN_OhcktVmVvCj1zw,"My wife and I have frequented the downtown Hoboken location, and love it. Uptown is likewise a winner. And they have a bar - with great, hospitable and fun bartenders. We had a blast eating and drinking at the bar, and all was delicious.",0,Ethan C.
181,181,8/20/2015,0,0,0,3,5.0,customer_0,CrY94yEQk9veSreOTJ5O3g,"If you ever go to La Isla make sure you call and see if ""RED"" is working the bar! He is amazing!!!!!!!!! This about my 4th time here, Food is great but the atmosphere is why i keep coming back!!!!! I am happy to find him behind the bar again once again in hoboken!! Menu not need when you see this dude!!",0,Jonathan M.
182,182,8/17/2015,0,2,0,41,2.0,customer_0,MORfhK-rAhKXtxjhSbJ2vA,"We came into the restaurant about two weeks ago. First impressions were good. The layout is spacious, there is a nice bar area and ample seating for groups of a variety of sizes.",0,Mike P.
183,183,8/11/2015,0,41,5,15,4.0,customer_0,ETVQmeBpXJ5YyyClVj94RA,Beautiful small restaurant!! With a real Cuban flavor... The food is delicious! ,0,John T.
184,184,8/9/2015,0,7,18,185,5.0,customer_0,a1bG_M3U-g9bHnqos5t5xw,"Headed to Hoboken for Italian and stayed for Cuban instead. Started with White Sangria. Very nice. Felt like summer vacation. Had chicken empanada. Best I've ever had. Full of flavor. No crazy ingredients. Had chicken soup and excellent. Intense chicken flavor in broth. Lots of perfectly cooked shredded chicken. Home made, not from a Panara soup bladder. Had steak milenesa. They wouldn't add eggs which was odd. However, may have been the most flavorful milenesa I've ever had. Very pleased. For dessert I had the coco flan. After a meal of great food, this flan took the crown. Perfect texture and flavor. Nice sauce. Ground coconut shavings on top with a cherry drizzle. Yummmmmmy. The yellow rice was subpar. The plantains were fine, but nothing special. Would go here again.",0,Andrew D.
185,185,8/8/2015,0,15,0,5,5.0,customer_0,hczBnWPrroXG4t19NO8zSA,"I've been to the La Isla downtown and found out about the new uptown location randomly. Went on a Saturday night, service was absolutely fantastic and the drinks at the bar were amazing. Come for the great drinks, incredible food, and go see John at the bar - awesome experience!",0,Andrew K.
186,186,8/8/2015,0,0,7,4,4.0,customer_0,FSlGDkiPkAsVj-UMuwZBUQ,The ropa vieja was great especially with tostones covered in moj. The pineapple and coconut mojoitos were good.,0,Dominicu D.
187,187,8/2/2015,0,0,0,48,1.0,customer_0,YQ_wBs3Dnwpp7cMEuXZnkQ,"I love La Isla downtown, this new location, big meh.",0,Sydney B.
188,188,8/2/2015,0,70,5,38,1.0,customer_0,QNuyLfrIReH8IM01EIFWdw,"Nice new decor uptown but horrible service. I went once late night and it was quick especially since we got a Cuban sandwich. I came back with my family for dinner on a Sunday and they ran out of every special, bread (so no sandwiches), roasted chicken,avocado- all of the basics. After ordering the waiter came back to us about 4 times because they kept ""running"" out of food. Keep in mind they had just opened at 5 pm and that is when we sat down. The manager was no help at all and stated he was upset with the limited amounts of food ( which isn't our problem!). How do you run out of food at 5pm. Will not return- horrible customer service! Disappointed- waste of time.",0,Amanda B.
189,189,7/31/2015,0,119,1,5,5.0,customer_0,Bj2vQc42teKXQS9xhbXCxQ,"Went here last week and had the swordfish special with cauliflower Brussels sprouts And a caper sauce. It was amazing, recommended by Red. One of our favorite restaurants in Hoboken. Very accommodating menu for gluten free!",0,Daniel R.
190,190,7/29/2015,0,184,15,180,4.0,customer_0,B5NEGvn56Qwof4LQAvmBvw,I'm a sucker for good Cuban food and this place delivered. We walked in on a Sunday night and were told they only had room for us at the counter. I'm actually a fan of sitting at the bar because I find that you normally get better service and most times a show. On this night everyone seems very busy and a bit overwhelmed. Our waiter took our drink order but the beer list wasn't updated so we had a bit of confusion when figuring out what to order. We opted for the arroz con pollo and half roasted chicken. Since our food was a special of the night it actually came out of a steam table which normally would terrify me but in this case the food was still delicious and the chicken moist and tender. Bae's chicken was also on point and it came with two sides. The tostones were hot and delicious but lacked in that delicious garlic sauce I'm accustomed to. We tried to be healthy by getting veggies but they were lathered in butter and garlic. ,0,David S.
191,191,7/27/2015,0,13,2,8,4.0,customer_0,fknZXFnXK-qGJpL-hfxdSw,The food is delicious. My only complaint is the noise factor. Why didn't they think about the acoustics more when they built the place? You literally have to scream to hear your table mates on a Saturday night.,0,Amanda N.
192,192,7/27/2015,1,41,2,122,2.0,customer_0,tKmNRK2lja7B_8j84sLU_g,"This should really be 2.5 stars, I just can't give it ""A-Okay.""",0,Julia W.
193,193,7/26/2015,1,317,1156,552,4.0,customer_0,cAqoHcnl5RWYs1P5sOMvug,Long awaited arrival of one of my favorite downtown spots uptown. The decor is nothing like the original; the is one feels like an upscale location that could be in Miami or in a hotel lobby in Cuba. It's bright and airy and lively. ,0,Dave F.
194,194,7/24/2015,0,4,0,6,5.0,customer_0,dmgQM_xLtN4_Xd5Z6i7kYQ,The Cuban sandwich was excellent as was the Camarones Enchilados... Service was friendly and knowledgeable... Best part of the experience was the Habanero Mojito- its truly a must have!!,0,Dean A.
195,195,7/15/2015,0,0,0,6,3.0,customer_0,HJQdY6UauCE4Wc4ZuuECtg,"First off, my friend and I are huge fans of La Isla and have been going there for many many years, in fact, it's my favorite restaurant on the planet to date. We were so excited that they had decided to expand and open a new location closer to home. That being said, I was very disappointed in our dinner last night at the new location. The new place looks amazing and the service was excellent, however it was extremely loud and we had to shout at our friends in order to be heard in a conversation, it was like being at an elementary school cafeteria during lunchtime. ",0,Rochele T.
196,196,7/5/2015,0,25,0,109,4.0,customer_0,-aCJ_am-d0QGymjeNXyfbA,"I've eaten at the original La Isla down on Washington Street a few times and always enjoyed the food there, but I was especially glad when I noticed they were opening a second location closer to where I live. On Friday (07/03), my boyfriend and I decided to check this place out and see if it was just as good as the La Isla we've come to know and love.",0,Donna F.
197,197,7/5/2015,0,1,4,28,2.0,customer_0,r1fJ1xZp0KMncLNwZxn5iQ,"Food was not bad but I felt that I experienced a soft opening and ended up paying the bill.I ate there on July 4th and was offered a very basic menu (3 starters, 3 main courses). We were told it was because it was the 4th July (!) but I think it was because the chef still cannot cope with a full menu. When I noticed people eating a Cuban sandwich at the bar I asked if they still had some and the waitress told me that it was available, why she didn't mention it when she offered us the menu is strange... Waitress was very sweet but all over the place, seemed very confused and stressed. Drinks are very, very weak and not worth the price, I couldn't taste any alcohol at all. I really want La Isla to be a success but they need to get their act together otherwise people will just walk to The Cuban or Havana. I will try again in a months time and hopefully things will be different. Hostess on our way out seemed a bit out of space and didn't even wished us a good night...",0,Roger P.
198,198,7/4/2015,0,2,6,27,3.0,customer_0,z4rjICv0F1IA91NhwsPCng,I live on 14th street so wanted to try the new restaurant just a couple of blocks away. Unfortunately I think they're still working out some of the kinks of the business. Our waitress was lovely but service was SLOW - it took over 30 minutes for a cold appetizer to arrive. I ordered a cocktail and it tasted great but there wasn't even a trace of alcohol in the drink and the serving size was tiny.,0,Richard D.
199,199,7/4/2015,1,468,3130,89,5.0,customer_0,HL3sHXWNr4Fg2Z4S8cLkMA,La Isla is one of my favorite Cuban restaurants in Hoboken and I am SO happy that they opened a location in uptown. I no longer have to track downtown! This location is a lot more spacious and nicer than the downtown location. Don't get me wrong - the wait may (will) still be there! So far the food is identical to downtown (including some of the staff so you might see familiar faces). Incredible food - I absolutely love their cuban sandwiches and Cuban coffee! ,0,Michelle C.
