,Unnamed: 0,date,elite,num_friends,num_photos,num_reviews,rating,restaurantId,review_id,review_text,useful,username
123,123,3/10/2016,0,0,1,3,2.0,customer_0,hhn2iVCCis9SJCVi1HjhSQ,"We celebrated a family member's birthday here. I called ahead and asked if they had cakes like in birthday cakes. The answer was ""no they had desserts"". I showed up with a birthday cake and was told there would be a ""cutting fee"" of $1.50 per slice. This is not about the money, however I felt that the manager specifically was not consumer friendly. So as a family we decided to enjoy the cake at a members home, since it was clearly not something the restaurant wanted. The dinner and wait staff were excellent. I enjoyed my dinner and asked if I could get a little more of the Chimichuree sauce, which I did get. So when the check arrives there is an additional, though nominal fee for this tiny amount of the sauce. I was really feeling like this place will nickel and dime you to death.. I think they need to be more willling to serve the customer. I felt like the manager was doing us a favor. I did speak to him to see if he would reconsider, he did not.. Good luck moving uptown. I dont think they will last with these petty fees that by the way, are NOT on the menu. I wont go back. I wouldnt be surprised if they counted the ice cubes in the drink. Needless to say if took the fun out of the Birthday part of the dinner. I found the manager to be very inflexible and not very accomodating.",0,Colleen P.
124,124,3/6/2016,0,26,11,17,3.0,customer_0,1hD2zB7d3ERm_Jlfdm2cnw,"Food was not a disappointment but nothing to rave about. If you want to go here for brunch, so make a reservation and go before 2 pm. ",0,Nikhil G.
125,125,3/5/2016,1,313,940,653,2.0,customer_0,KYO5an58r8QIMlg9sNZDpw,"This place deserves a 2.5. If you look up ""average"" in the dictionary there is a picture of this place. Came here with some friends and 2 of us ordered the huevos rancheros which was... Average. A friend of mine ordered the stuffed french toast and it was hard and dry. I think they needed syrup. The place is nicely decorated i will say and service w",0,Nicholas G.
126,126,2/25/2016,0,107,22,111,5.0,customer_0,-P5VjmQXuF8U1oqHOvRR1A,Love it! I've been going to the downtown location for YEARS but this one is great also. I really like this location for dinner. The service is impeccable and the drinks were great. I forget the drink's name but it had tequila and coconut cream and I recommend it. The food is just as good as downtown. Definitely make a reservation place is always slammed.,0,Kelly R.
127,127,2/21/2016,0,367,105,107,5.0,customer_0,vELKsRgBUL_FcuW6nlzorw,"Cannot say enough about how wonderful our experience at La Isla was! First and foremost, I have to give a shoutout to Sandra, our extremely wonderful and accommodating waitress. She gave us a sample of the wine to make sure we liked it before purchasing the entire bottle and was able to get us an order of Tres Leches even after the kitchen had closed. As for the food, it was HEAVEN! I got the chicken w/garlic sauce & spinach with a side of yuca and rice. Sandra even was able to get us some beans so we got the full experience. Lastly, I have never had a more delicious Tres Leches cake than I did here last night. It was the perfect blend of spongey and milky. I will definitely be coming back here again as soon as I can and cannot wait to see Sandra again! Highly recommend this place to anyone looking for a trendy ambiance with delicious food and drinks!",0,Aparna T.
128,128,2/21/2016,0,1,0,2,5.0,customer_0,xfmGN7MHWSpnfSIkGzUwuQ,"This place was a mix of amazing food and amazing service. Our waitress answered all our questions, even got us the dessert despite the fact that the kitchen had closed. We ordered garlic chicken and caramelized chicken and the sangria. Then for dessert we got the tres leches cake - which is probably the best tres leches cake I had. Highly recommend this place! And ask for Sandra; she was a great waitress.",0,Tanya G.
129,129,2/14/2016,0,4,0,20,4.0,customer_0,wlIrdnQiMWSRDYrgRJ7Mlw,"I love love love this place. Both locations are wonderful. The uptown location is beautifully decorated, the staff is friendly and the expanded menu is on point. The new dishes are creative and fresh. Every single one of their salads is absolutely delicious. They have fun, creative drinks. It is a nice addition in a town full of Italian joints to add some variety and great food into the mix. ",0,Erika W.
130,130,2/13/2016,0,95,3,57,4.0,customer_0,6JM_HPbR5y9FJOjdTt21_Q,the place has nice vibe. food is great. service is a bit chaotic but our servers were very nice.,0,Fan S.
131,131,2/8/2016,0,0,0,2,5.0,customer_0,QI2Bo2ekkKN__BL4IUIqNA,"Loved it! Went to the new location for the first time on Sunday for brunch after a relaxing facial, with my girls Sonia & Shenaz. We sat at the bar and the service was amazing. The staff was on point with their customer service, especially Joe and Sandra; the food was amazing! Convinced my friends to try the cafe con leche - and they weren't disappointed. We will be back soon!",0,Liz M.
132,132,2/6/2016,0,3,1,35,5.0,customer_0,pbfwdyX4bWxFcamS4kOx1Q,This place is great! Ive been here for brunch and had lunch here. The brunch is great for their crunchy stuffed french toast. It really IS the best french toast you will ever have. I also got their steak and eggs which was great also. We had a few brunch drinks that were also great (they have a full bar). Another time I got a cuban sandwich to go for lunch and it was awesome. I love cuban sandwiches and Im pretty picky but there was nothing to complain about with this one. The sandwiches were HUGE and you can probably just eat half or split it with someone and still be good. Service was nice both times. Will definitely be back.,0,Alexandra M.
133,133,2/4/2016,0,41,0,10,3.0,customer_0,A84V8SJN3OrvEgL67NAGew,"La Isla Uptown-Decor- great Food- very good when finally brought out the right temperature. Our ""server"" Sandra however was personable, but something was very off- She took our drink order n came back in 10 mins asking us if we were ready to order drinks. (!?!) We ordered jalapeno margaritas n recieved mojitos, which we accepted anyway by the time they got there. One of our table entees was returned twice due to being cold. A beer glass half full, was accidentally knocked over n broke, we asked for her help in which she took her time returning with napkins she handed to us and left the broken glass all over the table with the half broken beer glass standing n beer spilled all over the table dripping on my pants. Such a pretty place w great food, I suggest they spend a bit more time on interviewing staff to match the level. I couldnt imagine this level of service in a low level diner. It was hands down the worst server i have ever experienced n the rest of my party of 4 agreed. They took the cold entree off our bill- but charged us for Patrone Silver margaritas for which we received Mojitos. They r made with rum. Get it together.",0,Kelly M.
134,134,2/1/2016,0,0,4,14,3.0,customer_0,M8KYERuUSffYsEF5tvXVXA,1st time at the Uptown spot. ,0,Maripili R.
135,135,1/31/2016,0,37,18,39,2.0,customer_0,431OzGjy3Lt6pk2p5DfaMg,"The food is really good, but the restaurant is in desperate need of a good manager. The definally need to expand the menu. They are out of everything.. It feels like I was back in Cuba with food rations.  They are out of everything. You must ask what they have from the very limited menu. For a cuban restaurant not to have masitas de Puerco , baca Frita , ropa Vieja on the menu. They really need to expand and keep track of what to have in stock. But I have to say if they have it it is good food, the taste is really good. The service need improvement like the manager.",0,Robert R.
136,136,1/23/2016,0,4,9,96,4.0,customer_0,Fcbqp5EUJKdhkLc0iMslfw,"We ordered La Isla for pick-up last night and I must say, I was impressed. The first time we dined in here, I was not as enthused about the food here partly due to the reputation of the downtown location and the quality of what we ordered. That said, I was hoping to give them another shot. ",0,Charles B.
137,137,1/21/2016,0,0,3,10,5.0,customer_0,FgnXGs9ICMSROjcy-7gstg,So good that i wish i could give it six stars. I am a little bit of a food snob and this placed surpassed expectations. Prices are VERY reasonable too.,0,Justin S.
138,138,1/19/2016,0,0,0,3,1.0,customer_0,6uGC-tx6ILNe-Mpc1k0-Cw,"My husband and I attempted to go here on Friday night. We really love the downtown location and were excited to eat at the uptown one on a recent date night without the kids! We had changed the Opentable reservation and when we arrived they had no record of our reservation. While I understand sometimes errors happen, the way we were treated was horrible. We just got a blank stare -- and they told us no we don't have your reservation. Not even an invitation to wait for a table or a seat at the bar. We have dined at fine establishments around the world and have never encountered such rude service. I was really disappointed and will not go back. And will tell all my friends in town. Part of what is charming about Hoboken is that it is a small town where everyone is nice. The attitude encountered at La Isla was stunning.",0,Adrienne A.
139,139,1/13/2016,0,0,0,1,5.0,customer_0,-NVv4EEyGxBBEP_SvQOtlA,"Great service. Great food. Fresh homemade flavor. Restaurant is clean, well laid out and the decor creates a very relaxed ambience ... Cocktail list is awesome. Recommend the pineapple habanero mojito and the Bianchi Cab. Both delicious. Cuban sandwich , Isla salad, and chicken noodle soup ... All worth going back for. ...SEE YOU GUYS AGAIN SOON!!! Save me some Bianchi.",0,Hector T.
140,140,1/12/2016,0,3,1,34,5.0,customer_0,c_1o8jaB9ThJUX1NG8uYOQ,Amazing place! The service is usually great and the food is amazing. I've been to brunch here about 5 times and it gets better every time. Can't wait to go back again.,0,Tanner R.
141,141,1/11/2016,0,0,0,1,5.0,customer_0,mlTU9YMH5Q9fb4ku_gtyvw,This is my go to spot in Hobo. Waitress Sandra is awesome :),0,Elis N.
142,142,1/11/2016,0,4,0,45,2.0,customer_0,Xjj-FmQIHAyxlziUf2_nxA,"I had high hopes for this place before it opened since it's more convenient for me than the downtown location. The interior looked very upscale, but my experience eating there really left a sour taste in my mouth. Of course, the hour wait may not have helped my impressions, but I was still excited to eat when we finally were taken to our table. Unfortunately, the service was spotty at best (we couldn't even get our server to bring water to the table within 10 minutes of sitting down, and our drink orders didn't come for nearly 30 minutes). Plus, the food was bland and dried out. Maybe I went on a bad night, or maybe the restaurant is experiencing growing pains, but I won't be returning for a while.",0,Brian M.
143,143,1/8/2016,0,0,3,8,5.0,customer_0,nRJhtEgVXTccEb-PeDBYvQ,"Service - unreal. Ask for Sandra, and then ask her about her sweet dog Xena, like the princess! She is sweet, accommodating and absolutely wonderful. We ordered beef and chicken empanadas to start and then most at the table had the steak chimichura - not that name on the menu but you will find it! Good food! My god.... Delicious on a plate !!!!!!! Steak was so moist- and absolutely flavorful- you need to be here.",0,Kellie L.
144,144,1/8/2016,1,513,233,263,5.0,customer_0,CLFP7ga8_goCNG8gkEIdNw,If you liked the downtown location then you will love the classed up uptown location. Same food in a better setting.,0,Lorenzo T.
145,145,1/7/2016,0,39,5,1,1.0,customer_0,p8AZSekivw5C_D9ipPikjw,"Ordered via seamless for take out. 2.5 hours later a soggy empanada, wet meally shrimp and leathery steak. woman I spoke to on the phone didnt seem to care I that I called to complain about it. resturant is actually fairly good, but avoid takeout at all cost.",0,jeff e.
146,146,1/5/2016,0,0,0,8,1.0,customer_0,ky_i7g016VDoguHkmF4HDQ,"I went last Sunday, with our baby sleeping in the stroller.",0,Eduardo F.
147,147,12/30/2015,0,0,0,2,3.0,customer_0,ZSCH8ADbMpYTj2yWY1GFsg,I gave 3stars I added a star because at the end of our dinner the manager finally helped us but I'll start from the beginning...,0,Princessa B.
148,148,12/26/2015,0,16,6,6,5.0,customer_0,7MjSygd_Fj4sqHD3Tt66Hg,"Amazing Latin decor, fresh flowers throughout the entire restaurant, especially when you walk into the bathroom --- I was greeted with this refreshing & alluring smell of my favorite flower - exotic tiger lilies. My boyfriend & I visited this establishment on Sunday for brunch. We sat at the bar & received full-service treatment from their bartender, Joe. He was very attentive and made me a delicious virgin Bloody Mary w/ just the right amount of spice.",0,Erica M.
149,149,12/13/2015,0,9,0,25,5.0,customer_0,Bq-vepAM3h42PzVkZShU4w,Exceptional food & service! Menu options were creative and the El Basero was delicious! Definitely one of the best brunches in Hoboken. Highly recommend.,0,Stacey S.
150,150,12/5/2015,0,30,0,2,5.0,customer_0,ToDSUvJM4tpDg-1d3s7Rjw,"Love the new uptown location. Food was great, decor and ambiance fantastic, and our waitress Sandra was a delight!",0,Angie G.
151,151,12/4/2015,0,177,20,523,5.0,customer_0,GE0x3CgBl2jZQp_MZhoT7w,"They did such a great job with this space (now that they've mostly resolved the noise issue). It has become our go to in the neighborhood and is one of the few places in town without a TV (gasp!). The front area was designed to look like the lunch counter downtown and the back is a stylish dining room with a nice bar and huge windows. The music gives it a fun vibe, but I'd imagine hearing the same playlist every day must drive the staff nuts...but you'd never know because the staff always brings a smile to your table. Like downtown, they're open for all 3 meals and the prices are beyond reasonable. The addition of reservations makes Uptown a reliable dinner destination for your group, which downtown never could be. And...they just introduced happy hour M-F 5-7.",0,Jeremy W.
152,152,11/18/2015,0,0,0,5,4.0,customer_0,jPNTvJDCxg3lR1KXacQAiQ,"I always liked the downtown location but was too lazy to go there & wait for a table. Now the uptown location has become a go to breakfast & lunch spot. Food is good & well priced. Service was quick. I recommend the cuban sandwich, empanada & chicken club. To drink, sangria.",0,Jackie G.
153,153,11/16/2015,0,12,0,16,5.0,customer_0,KCOKyF_NIKFpwVD31JoPvQ,"Fantastic food and service! Just dined here and had a great time. Our server, Sandra was fantastic. The fried yuca was unbelievable and the mojitos topped off a great evening. Can't wait to go back again!",0,Claudia C.
154,154,11/15/2015,0,114,1,4,5.0,customer_0,W74E0eFy3ogysjngZzqYbg,"I love La Isla in Uptown Hoboken! Finally a place close to Maxwell that has authentic Cuban food. Being born and raised in Cuba, I know the difference! The portions are great, the variety is amazing and the customer service is excellent. You have to try their carne con papa and their Isla burger is to die for! Needless to say that the guava french toast is the most delicious thing I have ever tasted! I'll never get tired of their food. Thanks La Isla, I'm your biggest fan!",0,L. L.
155,155,11/15/2015,0,8,51,55,5.0,customer_0,OjOHJ7OB7Xqv4XLe-Eku9Q,"As always, the food at La Isla was fantastic, especially their key lime pie desert. Plan to order a pitcher of sangria instead of just a glass and you'll be happy you did! The service has also greatly improved since this location opened.",0,Amanda P.
156,156,11/14/2015,0,0,0,13,4.0,customer_0,Zy5VTmtkVgvr-YIpyUj4mg,"Food here is SO good. They lose a star from me because they tend to rush you--even on a Thursday night they're pushing you out and I don't like that feeling of ""oh man we better go now I can tell they want us to leave"" (we had been there less than an hour)",0,Kay K.
157,157,11/9/2015,0,5,3,9,5.0,customer_0,c_9svvxANXUQ3RFXuC_D5A,"La Isla, is about as good as it gets! I was a frequent customer of the downtown location and would go there for breakfast a lot during the weekend. So, when I heard they were opening another location, I was siked. ",0,Hunter C.
158,158,11/8/2015,0,0,2,4,1.0,customer_0,eLARbU8BXF5oQxpxcAsSww,The original location is so much better in terms of quality and service. It is a hole in the wall but was always delicious and worth the wait when we used to live in Hoboken. Heard they opened a larger location uptown and we were so excited to finally try it. The whole experience was disappointing from the moment we walked in. ,0,Jenny L.
159,159,11/5/2015,0,0,0,12,5.0,customer_0,Sq6CNl-AsgDbG6Lz3NrTRQ,"Outstanding! Same great food and prices as the downtown La Isla. Great bar, creative food, great service, and great atmosphere. Love it!",0,Rick S.
160,160,11/2/2015,0,1,1,19,1.0,customer_0,q4DE3ejPT0IGEr4Oqtcehw,"I so badly wanted to like this place! I live closer to their downtown location and frequently buy coffee there so when I heard this place opened and had a bar, I was so pumped. My friend came to visit from out of town so I got us a reservation for Friday night. They did seat us on time and our waiter was very nice however my experience with my meal was the worst. I ordered the salmon (which was recommended by the waiter) and my friend ordered the strip steak. While we did wait a bit for the food, it wasn't anything too crazy. When it finally came out, my salmon was basically raw and the inside was almost gooey. I told the waiter and he brought it in the back to be cooked more. This took a while. I didn't my friend's dish to get cold so I made her eat while I waited. When they finally brought mine back out, I was about half way through and what happens? I discover a huge hair. I would've thought it was mine but it was literally embedded in the salmon. I didn't want to say anything but the waiter came over just as I was pulling it out and my friend had a horrified look on her face. Immediately he said ""omg"" and rushed over to the manager. They didn't charge me for the meal but I went home hungry and grossed out. I don't know if I'll be able to come back.",0,Anne L.
161,161,10/24/2015,0,0,0,8,1.0,customer_0,LAY36oTWUOaeEFF8gfuDeg,"I live across the street and had high hopes for La Isla but am so disappointed after three dinners over the past 2 months, I will never go again. It was so noisy I couldn't talk to my dinner partner. My head hurt after 20 minutes of trying to scream to be heard above the restaurant noise. The food was not good either. On my last try, I had the salty plantains and they were barely warm round greasy tasteless wafers. The black bean side was lukewarm and the little (I mean tiny) beans were buried in a black watery substance. My friends feel the same as me and we are giving up on this restaurant. We really need a good casual restaurant in this location and hope someday one replaces La Isla Uptown.",0,Becky C.
162,162,10/19/2015,0,104,0,212,5.0,customer_0,HWeoSQzixo0sIHGZvyUhDQ,"I'm pretty skeptical of restaurants expanding, as I feel growth breeds mediocrity in cases where the restaurant wasn't really built for scaling (e.g. Grimaldi's, Shake Shack, Carlos Bakery). So when I heard of Hoboken La Isla opening another location uptown, particularly in Maxwell, not surprisingly, I wasn't too enthused. After all, Cuban food in Hoboken is fantastic between The Cuban, Zafra, and La Isla. I think there's a rubbishy one somewhere by the PATH, but I can't remember the name at the moment.  ",0,Scott S.
163,163,10/12/2015,1,940,465,1297,3.0,customer_0,FbywQ4np7i5LeEz8rizmAw,"The original, downtown La Isla had been featured on Throwdown with Bobby Flay, and its chef had even won for his stuffed French toast. So, between seeing that episode and witnessing the long lines of waiting diners on the sidewalk, I was so intrigued that I needed to check the place out. Well, rather than subjecting myself to the lengthy wait time, I decided to grab a Chicken sandwich to go. I got to my apartment, tore open the packaging, and took a crunchy bite into the pressed bread stuffed with grilled chicken breast, lettuce, tomato, and crispy potato sticks. As I swallowed, I slumped back in my seat, disappointed by the dry meat and lackluster toppings. Don't get me wrong, I ate the entire thing, but I did not find it as flavorful as I had expected.",0,Alison C.
164,164,10/6/2015,0,5,9,12,5.0,customer_0,n_A88sR15PZ2uHCuhzmUHA,"I would start by saying that I live right across the street, which not only makes it convenient, but dangerous at the same time, because I would love to go everyday. ",0,Victor R.
165,165,9/27/2015,0,0,0,3,3.0,customer_0,WT0Yd6a3Emw2NS3mNJw5dA,"Disappointing. Very loud. Very very cramped in the back room. We sat at a table in the middle and we were all banged and bashed by the rear ends and elbows of the waitstaff over and over without apology. It all might work if this was a quick in and out joint but it is designed as an upscale-ish uptown restaurant, not a downtown joint. This restaurant needs to decide if it is to be a cramped and crappy joint with OK but not special food and untrained waitstaff or a pleasant place to have a relaxed meal with the family. Since it is designed to be the latter, there needs to be a complete re-think of the way it is organized.",0,Jay E.
166,166,9/27/2015,0,1,0,4,4.0,customer_0,xsT2XEK6PSW0zIoNDw0XLA,"Great new spot in uptown. Black bean hummus served with plantain chips is a must! Sangria was just okay, Have been there 2x, the first time around my bartender was excellent! Second time around we had a new bartender who seemed stuck up for lack of a better word. All in all would make this a regular spot.",0,Kara T.
167,167,9/23/2015,0,1,2,71,3.0,customer_0,rlOcVnxtFEIXP_b98RI_aw,Hit the new la isla today for the first time. Beautiful new space with great atmosphere and high ceilings. Solid craft beer list and cocktail list. My date had a spicy pineapple vodka drink converted to a margarita and the staff was happy to accommodate.,0,Marc G.
168,168,9/19/2015,0,121,29,214,4.0,customer_0,uIOKGddCVUmNk8HKa7uwNQ,Always been a fan of the downtown location. Uptown is fancier version but same great taste and service. Also has a new addition to the menu called the la Papa which is phenomenal.,0,Adam K.
169,169,9/14/2015,0,170,4,21,3.0,customer_0,WPSkNxcDQ-MxnYEBJYeXbg,"The food was great, but the service was severely lacking. While our server was very sweet and accommodating, it took them over an hour to get us out food. There was only 4 of us, so I believe they only did half of the order and forgot the rest because 2 of our dishes were cold and 2 were moderately warm. The staff tried to accommodate us by giving us complimentary empanadas and dessert, but not sure if a 2.5 hours dinner experience with just entrees ordered was justified. Basically, I think the food was good, but the service/kitchen needs to step up its game before I return.",0,Tara T.
170,170,9/13/2015,0,0,0,10,5.0,customer_0,yfvmi4f-UaMM6UsMncanwg,Space AND reservations?? The new uptown location has the same amazing menu and you have the space to spread out. So happy this location is open and they have a great craft beer selection as well.,0,Jessie E.
171,171,9/10/2015,0,11,0,4,1.0,customer_0,xP1A0VV06QtAtyTBcZQV-A,Came in 10 minutes before closing and dirty looks and teeth sucking. Seemed to have a town hall meeting about whether they should serve us.. right in front of us.. just left. They advertise open till 10 but whatever,0,Mostafa S.
172,172,8/31/2015,0,4,4,30,3.0,customer_0,IHit1nwN7OnOs9-ToDCaxQ,"Food is great, but wish the service was better. Really good atmosphere and a fun place to go to. They have a counter to sit at and order from with tables surrounding them - I like that they have both options. Good menu and great food, but the service was so bad. Our waitress barely came to the table... took forever to order and then once we ordered (and gave our drink orders as well), didn't see or hear from her for about 30-40 minutes. Got 2 drinks and had to tell her when she brought our food out 30-40 minutes later that she forgot to bring them over. I'm sure I'll return eventually, but not that anxious to get back anytime soon.",0,Erin J.
173,173,8/29/2015,0,272,514,238,3.0,customer_0,3XUKsTRLXBgMmOR9sKSPBQ,"What a difference 12 blocks makes... As a semi regular at the original la isla location, I decided to try the new iteration. Wow. Soaring ceilings with Caribbean style fans, beautiful Spanish tile floors, the rest of the interior white, airy and chic. Latin jazz vibrated gently in the background. This is definitely not a diner, drive in, or dive.",0,Sandra B.
174,174,8/29/2015,0,85,15,24,2.0,customer_0,g6yL4K30JO0p70KXT6XnTQ,Service is glacial. Quality of food is far lower than the original location. Almost none of the veterans from the old location are here and the operation does not fill the big shoes it has to fill.,0,Jonathan M.
175,175,8/27/2015,0,1,5,43,4.0,customer_0,VwOlIOwoExkyjqJDYXHXkg,"I took a couple of folks here tonight for a work related dinner. The food and the service were great. We ordered shrimp, salmon & chicken. All 3 dishes were delicious & plated well. We shared the keylime pie for dessert, yumm. ",0,Kam T.
176,176,8/26/2015,0,1,0,13,2.0,customer_0,MQhewnbJILDMv5NCQVWUUA,"Came relatively soon after their official opening and were able to get a table for two with ease across from the counter.The new establishment was noticeably louder and seemed designed to do a lot more than their location on Washington St. Yet,that's where the problems occurred.",0,C N.
